{
  "schema_version": "0.1",
  "backup_id": "backup-alice",
  "identity_id": "alice",
  "profile_ref": "backup-user-secret@0.1.0",
  "generation": 2,
  "content_aead_algorithm_id": "ALG-AES-256-GCM",
  "backup_data_key_id": "bdek-gen-2",
  "backup_data_key_random_bits": 256,
  "backup_data_key_reused": false,
  "manifest_digest": "aaaaaaaaaaaaaaaaaaaaaaaaaaaaaaaaaaaaaaaaaaaaaaaaaaaaaaaaaaaaaaaa",
  "manifest_authenticated": true,
  "manifest_binds_identity_and_generation": true,
  "ciphertext_chunk_count": 8,
  "server_plaintext_access": false,
  "server_unwrapped_backup_key_access": false,
  "recovery_secret_uploaded_to_server": false,
  "secret_kdf_algorithm_id": "ALG-ARGON2ID",
  "secret_hkdf_algorithm_id": "ALG-HKDF-SHA256",
  "argon2_salt_hex": "11111111111111111111111111111111",
  "argon2_version": "0x13",
  "argon2_memory_kib": 65536,
  "argon2_iterations": 3,
  "argon2_parallelism": 4,
  "argon2_output_bytes": 32,
  "inner_wrapped_backup_key_present": true,
  "hardware_outer_wrap_present": false,
  "hardware_wrap_aead_algorithm_id": null,
  "hardware_key_non_exportable": false,
  "hardware_attestation_verified": false
}
